priority,source,prospect,url,channel,action,status,posted_or_sent_at,next_follow_up_at,notes
1,Reddit r/forhire,Emergency-Anybody734,https://www.reddit.com/r/forhire/comments/1ufdkbq/hiring_lead_gen_ai_automation_engineer_to_build/,public+dm,comment and DM,send_ready,,,Explicit paid hiring post; strongest non-Upwork lead from July 1 scan.
2,Make Community,Joseph_Linco,https://community.make.com/t/retell-ai-webhook-data-not-mapping-through-make-ai-toolkit-to-downstream-modules/111482,public,comment first,send_ready,,,Concrete Make/Retell troubleshooting request; DM only if allowed or after engagement.
3,Airtable Community,dbloemhof,https://community.airtable.com/jobs-board-16/airtable-process-automation-and-agent-integration-e-g-make-api-48303,public+dm,comment and DM/contact,send_ready,,,Explicit freelance support request for Airtable/Make/API/AI intake.
4,Reddit r/CRM,u/360gamer101,https://www.reddit.com/r/CRM/,public,comment first,draft_ready,,,Tennis centre custom CRM operating-system need; DM only after engagement.
5,Reddit r/CRM,u/justcheckingin38,https://www.reddit.com/r/CRM/comments/1u7nucs/crm_for_donor_management_to_complement/,public,comment first,draft_ready,,,Nonprofit donor/reporting workflow around Tessitura and Ticketmaster.
6,Reddit r/CRM,u/Delicious-Anybody742,https://www.reddit.com/r/CRM/comments/1u4jy1k/crm_for_a_consultancy_business_managing_clients/,public,comment first,draft_ready,,,Small consultancy CRM/process system with Xero and client portal needs.
7,Reddit r/CRM,u/MaxDmitrie,https://www.reddit.com/r/CRM/comments/1u8xlnq/we_generate_a_high_volume_of_leads_each_month/,public,comment first,draft_ready,,,High-volume lead SMS automation; keep compliance and reply handling central.
8,Reddit r/AiAutomations,u/Holiday-Occasion4189,https://www.reddit.com/r/AiAutomations/comments/1tz9hao/looking_for_a_tool_to_automate_job_hunting_and/,public,comment first,draft_ready,,,Agency opportunity monitoring/proposal drafting; likely B priority unless budget appears.
9,Make Community,Sales Tech & Make Automation Specialist thread,https://community.make.com/t/hiring-sales-tech-make-automation-specialist-ongoing-remote-work-crm-databases/111068,partner/watch,review and apply/contact if active,draft_ready,,,Ongoing Make/CRM/database work; use partner pack message if application details are visible.
10,Make Community,Senior Make.com Automation Engineers,https://community.make.com/t/hiring-senior-make-com-automation-engineers-ongoing-contractor-work-75-95-hr/105775,partner,application or subcontract note,draft_ready,,,Ongoing contractor work at meaningful rates; strong Make/API/webhook alignment.
11,Make Community,Make.com Automation Engineer contract part-time,https://community.make.com/t/hiring-make-com-http-make-com-automation-engineer-contract-part-time/103508,partner,public reply plus DM if still open,draft_ready,,,Names routers scheduling error handling HTTP webhooks REST APIs mapping and docs.
12,Make Community,AI Automation Project Coordinator,https://community.make.com/t/hiring-an-ai-automation-project-coordinator-discovery-documentation-qa-client-training-800-1-500-month-starts-short-term-with-strong-long-term-potential/96399,partner/watch,review activity before contacting,draft_ready,,,Lower budget but matches discovery docs QA and client training; useful partner lane.
13,n8n Community,n8n freelance collaboration search hub,https://community.n8n.io/t/in-need-for-someone-who-used-to-sell-ai-automation-please/141553/6,partner/search hub,open related active hiring threads,draft_ready,,,Related topics surface June 2026 n8n hiring and collaboration threads; verify freshness before outreach.
14,n8n Community,n8n sales automation coaching pattern,https://community.n8n.io/t/looking-for-an-n8n-coach-to-help-build-sales-automations/155149,watch/query pattern,do not outreach unless active,watch,,,Older paid coaching example; use language for sales automation query patterns.
15,PeoplePerHour,Tony C.,https://www.peopleperhour.com/freelance-jobs/technology-programming/e-commerce-cms-development/woocommerce-api-integration-developer-4506356,proposal/message,send PPH message,send_ready,,,Fresh WooCommerce Stripe QuickBooks Zapier workflow rebuild with error handling and idempotency; no Upwork connects.
16,Freelancer,Google AI Automation Setup,https://www.freelancer.com/projects/zapier/google-automation-setup,proposal,send narrow audit proposal,send_ready,,,Fresh open Apps Script Zapier GPT Google Workspace optimization project; high proposal count so lead with 3-5 hour audit.
17,Upwork,Orcha Mac Workflow Automation Developer,https://www.upwork.com/freelance-jobs/apply/Orcha-Mac-Workflow-Automation-Developer_~022071584300018681894/,watch,do not spend connects unless proof is strong,watch,,,Strong invoice/PDF extraction workflow fit but gated by Upwork connects and Orcha-specific requirement.
18,n8n Community,Jobs category same-day paid threads,https://community.n8n.io/c/jobs/13,public+dm,reply to 3 active paid threads,send_ready,,,No-Connect channel with multiple July 1 active n8n/AI automation buyer threads; customize from n8n community sprint pack.
19,n8n Community,TargetPatientsMD / katkat,https://community.n8n.io/t/hiring-freelance-ai-automation-engineer-remote/299853,email,send application email,send_ready,,,Freelance AI automation engineer role with Claude/n8n/lead-gen/outbound requirements and direct email application.
20,n8n Community,Technaros partner overflow,https://community.n8n.io/t/seeking-a-reliable-n8n-developer-for-ongoing-project-based-work-build-maintain/296828,public+dm,reply and DM,send_ready,,,AI consulting firm seeking dependable n8n builders for sandbox/staging project work; strong subcontract lane.
21,n8n Community,N8N AI Automation Developer Remote,https://community.n8n.io/t/hiring-n8n-ai-automation-developer-remote/298577,public+dm,reply or DM,send_ready,,,Active n8n Jobs thread for AI workflow build/maintenance; lower budget but no marketplace credits.
22,n8n Community,Hiring/vetting n8n developer advice threads,https://community.n8n.io/t/looking-to-hire-n8n-developers-for-ongoing-automation-projects-what-should-i-look-for/294759,public,post useful vetting answer,draft_ready,,,Inbound authority play: buyer asks how to find production-grade n8n developers and thread explicitly says community/referral beats Upwork.
23,n8n Community,Synergy Effect AI Automation Engineer,https://community.n8n.io/t/hiring-ai-automation-engineer-n8n-ai-agent-developer/294904,email+optional_public_note,email full 8-question application,send_ready,,,Project-based AI automation role with business processes APIs docs OCR browser automation and production reliability language; apply by email to info@s-e.lt.
24,n8n Community,Devender Indora telecom OSS PoC,https://community.n8n.io/t/looking-for-an-n8n-freelancer-consultant-with-telecom-oss-experience/300396,public+dm,reply with domain caveat,draft_ready,,,Fixed-price or milestone PoC for REST APIs PostgreSQL correlation workflows and AI agents; only pursue with transparent telecom domain caveat.
25,n8n Community,JEnterprises medical consulting platform,https://community.n8n.io/t/hiring-long-term-n8n-postgres-build-for-a-50-state-medical-consulting-practice-multi-tenant-self-hosted-runs-for-years/294834,public+dm,reply and DM,send_ready,,,Long-term n8n Postgres platform with RLS canaries approval queues and lead-gen pipeline; high upside but must avoid overclaiming public n8n proof.
26,n8n Community,Anatol Kupin SEO blog automation,https://community.n8n.io/t/need-a-custom-made-seo-blog-post-writing-automation/267669,public+dm,reply only if still active,draft_ready,,,SEO article automation with Drive files Telegram approval sources images and internal linking; older post so verify activity before sending.
